{
  "$schema": "http://json-schema.org/draft-07/schema#",
  "title": "lint agent-mode output envelope",
  "description": "Stable agent-mode JSON envelope produced by `rtlscanner lint --json`. CDC findings appear as regular entries in `data.findings` with `rule=\"cdc-crossing\"` and `check=\"cdc\"`. Note: SystemVerilog `` `pragma diagnostic ignore `` does NOT suppress `cdc-crossing` \u2014 use `[lint].waive` in `.rtlscanner.toml` instead.",
  "type": "object",
  "required": [
    "tool",
    "version",
    "status",
    "command",
    "data",
    "diagnostics",
    "errors",
    "summary"
  ],
  "properties": {
    "tool": {
      "type": "string",
      "const": "lint"
    },
    "version": {
      "type": "string"
    },
    "status": {
      "type": "string",
      "enum": [
        "ok",
        "error"
      ]
    },
    "command": {
      "type": "object",
      "description": "Echo of the parsed argparse Namespace minus output flags."
    },
    "data": {
      "oneOf": [
        {
          "type": "object",
          "required": [
            "findings",
            "waived",
            "config_path"
          ],
          "properties": {
            "findings": {
              "type": "array",
              "items": {
                "type": "object",
                "required": [
                  "file",
                  "line",
                  "col",
                  "severity",
                  "rule",
                  "message",
                  "check"
                ],
                "properties": {
                  "file": {
                    "type": "string"
                  },
                  "line": {
                    "type": "integer"
                  },
                  "col": {
                    "type": "integer"
                  },
                  "severity": {
                    "type": "string",
                    "enum": [
                      "error",
                      "warning",
                      "note",
                      "ignored"
                    ]
                  },
                  "rule": {
                    "type": "string",
                    "description": "Open enum. Known rules include `inferred-latch`, `unassigned-variable`, `undriven-port`, `width-trunc`, `port-width-mismatch`, `port-width-trunc`, `cdc-crossing`, `unused-port`, `case-default`. The `--rules bugs` preset keeps the real-bug subset plus all compile errors."
                  },
                  "message": {
                    "type": "string"
                  },
                  "check": {
                    "type": "string",
                    "enum": [
                      "semantic",
                      "unused",
                      "shadow",
                      "cdc",
                      "port-connect"
                    ]
                  },
                  "module": {
                    "type": "string",
                    "description": "Design unit (module / interface / ...) the finding sits in, attributed by source range. Absent when the finding could not be attributed to a unit."
                  },
                  "waived_reason": {
                    "type": "string"
                  }
                },
                "additionalProperties": true
              }
            },
            "waived": {
              "type": "array",
              "items": {
                "type": "object",
                "required": [
                  "file",
                  "line",
                  "col",
                  "severity",
                  "rule",
                  "message",
                  "check"
                ],
                "properties": {
                  "file": {
                    "type": "string"
                  },
                  "line": {
                    "type": "integer"
                  },
                  "col": {
                    "type": "integer"
                  },
                  "severity": {
                    "type": "string",
                    "enum": [
                      "error",
                      "warning",
                      "note",
                      "ignored"
                    ]
                  },
                  "rule": {
                    "type": "string",
                    "description": "Open enum. Known rules include `inferred-latch`, `unassigned-variable`, `undriven-port`, `width-trunc`, `port-width-mismatch`, `port-width-trunc`, `cdc-crossing`, `unused-port`, `case-default`. The `--rules bugs` preset keeps the real-bug subset plus all compile errors."
                  },
                  "message": {
                    "type": "string"
                  },
                  "check": {
                    "type": "string",
                    "enum": [
                      "semantic",
                      "unused",
                      "shadow",
                      "cdc",
                      "port-connect"
                    ]
                  },
                  "module": {
                    "type": "string",
                    "description": "Design unit (module / interface / ...) the finding sits in, attributed by source range. Absent when the finding could not be attributed to a unit."
                  },
                  "waived_reason": {
                    "type": "string"
                  }
                },
                "additionalProperties": true
              }
            },
            "config_path": {
              "type": [
                "string",
                "null"
              ]
            }
          }
        },
        {
          "type": "null"
        }
      ]
    },
    "diagnostics": {
      "type": "array",
      "items": {
        "type": "object",
        "required": [
          "severity",
          "file",
          "line",
          "col",
          "message"
        ],
        "properties": {
          "severity": {
            "type": "string",
            "enum": [
              "error",
              "warning",
              "note",
              "info"
            ]
          },
          "file": {
            "type": "string"
          },
          "line": {
            "type": "integer",
            "minimum": 0
          },
          "col": {
            "type": "integer",
            "minimum": 0
          },
          "message": {
            "type": "string"
          }
        },
        "additionalProperties": false
      }
    },
    "errors": {
      "type": "array",
      "items": {
        "type": "object",
        "required": [
          "code",
          "message"
        ],
        "properties": {
          "code": {
            "type": "string",
            "enum": [
              "INPUT_NOT_FOUND",
              "BAD_FILELIST",
              "COMPILE_FAILED",
              "SCOPE_NOT_FOUND",
              "SIGNAL_NOT_FOUND",
              "BAD_CONFIG",
              "NO_TOP",
              "INTERNAL_ERROR"
            ]
          },
          "message": {
            "type": "string"
          },
          "details": {
            "type": "object",
            "description": "Machine-readable recovery hints. For SCOPE_NOT_FOUND: valid_prefix, failing_component, close_matches, children. For SIGNAL_NOT_FOUND: close_matches, available."
          }
        },
        "additionalProperties": false
      }
    },
    "summary": {
      "oneOf": [
        {
          "type": "object",
          "required": [
            "total",
            "by_severity",
            "by_rule",
            "by_check",
            "waived",
            "files_linted",
            "has_error"
          ],
          "properties": {
            "total": {
              "type": "integer",
              "description": "True total finding count, even when `findings` was capped by --limit."
            },
            "shown": {
              "type": "integer",
              "description": "Number of findings actually emitted in `data.findings` after the --limit cap."
            },
            "by_severity": {
              "type": "object",
              "additionalProperties": {
                "type": "integer"
              }
            },
            "by_rule": {
              "type": "object",
              "additionalProperties": {
                "type": "integer"
              }
            },
            "by_check": {
              "type": "object",
              "additionalProperties": {
                "type": "integer"
              }
            },
            "waived": {
              "type": "integer"
            },
            "files_linted": {
              "type": "integer"
            },
            "has_error": {
              "type": "boolean"
            },
            "truncated": {
              "type": "boolean",
              "description": "True when an emitted list was capped by --limit; the count fields still report the true totals."
            },
            "limit": {
              "type": "integer",
              "description": "Effective per-list item cap that was applied (0 means unlimited)."
            }
          }
        },
        {
          "type": "null"
        }
      ]
    }
  },
  "additionalProperties": false
}
